{
  "report_id": "report_example_approved",
  "bundle_id": "bundle_github_repo_intelligence_standard",
  "status": "approved",
  "score": 96,
  "violations": [],
  "repair_prompt": null,
  "checks": [
    {
      "check_id": "matrix.control_files_present",
      "status": "passed",
      "message": "All required Matrix control files are present."
    },
    {
      "check_id": "matrix.forbidden_files_unchanged",
      "status": "passed",
      "message": "No forbidden control files were modified."
    },
    {
      "check_id": "matrix.dependency_drift",
      "status": "passed",
      "message": "No unapproved dependencies were added."
    },
    {
      "check_id": "matrix.validation_commands",
      "status": "passed",
      "message": "Required validation commands completed."
    }
  ],
  "created_at": "2026-06-12T12:00:00Z",
  "approved": true,
  "matrixhub_publishable": true,
  "summary": "The generated result follows the Matrix Bundle contract and can be published to MatrixHub dry-run."
}
